	question	answer	description
12674	Are these white light or yellow light? I need to replace the bulb on a Homedics M8051 mirror. Initially had white light.	White Light	['The Jerdon JPT25W 25-Watt Light Bulbs Replacement Pack is ideal for replacing existing bulbs that have grown old and burnt out. These 25-watt incandescent bulbs are specifically designed for lighted mirrors. These bulbs are a quick fix for your mirror in need and come in a 2-pack. The Jerdon JPT25W 25-Watt Light Bulbs Replacement Pack come with a 1-year limited warranty that protects against any defects due to faulty material or workmanship. The Jerdon Style company has earned a reputation for excellence in the beauty industry with its broad range of quality cosmetic mirrors (including vanity, lighted and wall mount mirrors), hair dryers and other styling appliances. Since 1977, the Jerdon brand has been a leading provider to the finest homes, hotels, resorts, cruise ships and spas worldwide. The company continues to build its position in the market by both improving its existing line with the latest technology, developing new products and expanding its offerings to meet the growing needs of its customers.']
12737	how flexible is this hand? I want one to model sign language	I wouldn't think this hand would be valuable for your intended purpose. Fairly rigid with limited flexibility.	['The Diane Practice Hand is perfect for students and professional nail technicians. Great for practicing all types of nail applications. Accomodates acrylic applications.']
12738	I am looking to sew this to fabric for a funny costume; do you think it would be possible to thread a needle through the plastic? or too thick?	It's definitely too thick for a needle to go through but may not be impossible. The plastic hand is hard and a little stiff, it is made this way so you can mold the fingers to go up or down and stay in place when you paint them.	['The Diane Practice Hand is perfect for students and professional nail technicians. Great for practicing all types of nail applications. Accomodates acrylic applications.']
12739	Could you put fake nails on the finger nails?	Yes, you can put fake nails on it. The nail beds are indented enough to accommodate acrylic applications.	['The Diane Practice Hand is perfect for students and professional nail technicians. Great for practicing all types of nail applications. Accomodates acrylic applications.']
12740	"100% Serious Question: I would like to purchase this as a ""High Five"" when employees do a specific task and nobody is around to high-five them. Would this make a good high-fiving hand, if retrofitted to a stand?"	A hand is a hand, but if your employees are open to giving a high five to a fake hand when no one is around, you may want to rethink who your employees are and more importantly, what kind of boss you are.	['The Diane Practice Hand is perfect for students and professional nail technicians. Great for practicing all types of nail applications. Accomodates acrylic applications.']
12741	Are the fingers spread enough that in the v sections they do not touch for about 1/2 inch up inside the v sections? Wanting to use this for a glove.	it's not 1/2 inch apart, it's less than that.	['The Diane Practice Hand is perfect for students and professional nail technicians. Great for practicing all types of nail applications. Accomodates acrylic applications.']
12742	Is this particular one a Left side hand? or right i need a left thank you	The one we received was a right	['The Diane Practice Hand is perfect for students and professional nail technicians. Great for practicing all types of nail applications. Accomodates acrylic applications.']
12743	"What size ring(s) would fit the ""wedding ring finger"" on the hand please?"	Probably size 5 and up. They are quite small fingers.	['The Diane Practice Hand is perfect for students and professional nail technicians. Great for practicing all types of nail applications. Accomodates acrylic applications.']
12744	can i use any press on nail kit with this hand?	Yes you can!	['The Diane Practice Hand is perfect for students and professional nail technicians. Great for practicing all types of nail applications. Accomodates acrylic applications.']
12745	Do the fingers bend enough to make the hand point?	No it is rather stiff.	['The Diane Practice Hand is perfect for students and professional nail technicians. Great for practicing all types of nail applications. Accomodates acrylic applications.']
12746	What kind of box does this come in? I know somebody who wants one, but I was also going to put a piece of jewelry on the wrist.Weird question, I know	Mine didn't come in a box of any kind. This looks more like a Halloween hand, so if it's a piece of nice jewelry, you might want to upgrade to an articulated wooden hand that's used by art students.	['The Diane Practice Hand is perfect for students and professional nail technicians. Great for practicing all types of nail applications. Accomodates acrylic applications.']
16099	Does this fit on a a twin turbo 2600?	Yes, I have both the Twin Turbo 2600 and this diffuser. No issues at all	['The Turbo Power Diffuser is the perfect addition to any hair dryer!']
16100	does this fit the twin turbo 3500?	it fits but is too big and too heavy. want mine?	['The Turbo Power Diffuser is the perfect addition to any hair dryer!']
16101	Will this fit the Wahl Complement X3 Multi-Barrel Hair Dryer?	Doesn't fit on any hair dryer my wife has tried. Not a good product.	['The Turbo Power Diffuser is the perfect addition to any hair dryer!']
16102	Will this fit any blow dryer that is not a Turbo?	I'm not sure. Because I have a twin turbo.	['The Turbo Power Diffuser is the perfect addition to any hair dryer!']
16103	are there opening in the fingers or are they solid?	They are solid	['The Turbo Power Diffuser is the perfect addition to any hair dryer!']
16104	I own a turbo 1500 blow dryer. Will this diffuser properly fit?	I would assume so. I have the twin turbo 3200. So as long as it's a twin turbo you shouldn't have any problems.	['The Turbo Power Diffuser is the perfect addition to any hair dryer!']
16105	Will it fit on a 2600 twin turbo?	I purchased this for use with my 3200 twin turbo. The fit is tight and stays in place perfectly.	['The Turbo Power Diffuser is the perfect addition to any hair dryer!']
16106	Will this fit on a 3200 Twin Turbo ceramic ionic blow dryer	No it does not fit properly.	['The Turbo Power Diffuser is the perfect addition to any hair dryer!']
17856	How far past the wrists do they extend? I've got arthritis there as well.	I guess that would depend on the size of your hands. They just cover my mother's wrists, but I don't think they heat much there.	['Soothes and nourishes skin and nails while replenishing the natural moisture balance in hands. Helps relieve the pain of arthritis and other painful conditions.']
17857	Do I have to order liners as well?	You get one pair of liners with the gloves. But they are just a plastic medium square of plastic. I've used mine several times and just wash them out. I amj also lucky because I have a box of 100 plastic gloves left over from when I was taking care of my deceased husband. I also color my hair and never use the gloves that come with them and can use them also. It is not a big deal, you can even use plastic wrap if you want. If you don't use a hand cream with your treatment, you can just wipe the inside with a Wet One ore the baby wipes. It hasn't been a problem for me, and the relief I get from them is well worth any inconvenience about the liners. In the winter when my arthritis kicks in, they are a lifesaver for me. I also bought the Homedics Para Spa where you dip your hand into the hot wax. This is also great for my hands. I hope I've answered your question satisfactorily.	['Soothes and nourishes skin and nails while replenishing the natural moisture balance in hands. Helps relieve the pain of arthritis and other painful conditions.']
17858	what cream do you use?	I use a cream made by Jergans. It is actually an all purpose face cream and very thick. It works wonders on my dry hands and nails. I also use it when I use my ParaSpa wax treatmenr and the wax slides right off of my hands.. I hope this helps	['Soothes and nourishes skin and nails while replenishing the natural moisture balance in hands. Helps relieve the pain of arthritis and other painful conditions.']
17859	What is the voltage range on this product? Is it only 110-120v? Or is it 100-240v? Inquiring minds wanna know...	Yes, the back of the mitts say 115 VAC, and 40 W if you were wondering :) Hope that helps!	['Soothes and nourishes skin and nails while replenishing the natural moisture balance in hands. Helps relieve the pain of arthritis and other painful conditions.']
17860	how to wash these mitts?	The outside or inside? Supposed to wear liners on hands and then insert into mitt.	['Soothes and nourishes skin and nails while replenishing the natural moisture balance in hands. Helps relieve the pain of arthritis and other painful conditions.']
17861	Can they be adapted to car use?	I have not tried, but if you buy an outlet adapter for car, you can plug it in. I use this type of adapters to plug in my curling iron and other electrical needs. Hope this helps!	['Soothes and nourishes skin and nails while replenishing the natural moisture balance in hands. Helps relieve the pain of arthritis and other painful conditions.']
17862	is it one mitten or a pair?	"Hi, there are two. One for each hand. They aren't actually mittens per se. They are more like mitts. In the description, it does say 'Mitts"" which is plural. :-) They are wonderful. They help my arthritis a lot. They have 2 heat settings and they are comfortable. I highly recommend them."	['Soothes and nourishes skin and nails while replenishing the natural moisture balance in hands. Helps relieve the pain of arthritis and other painful conditions.']
17863	Does it shut off automatically after a certain number of hours?	No, the mitts need to be turned off manually when you are finished with them. They do have low and high heat settings you can control.	['Soothes and nourishes skin and nails while replenishing the natural moisture balance in hands. Helps relieve the pain of arthritis and other painful conditions.']
17864	Would these fit on a man's large hands?	Yes, they will. I bought this for my mom's hands (she has RA) and they are pretty large/generous.	['Soothes and nourishes skin and nails while replenishing the natural moisture balance in hands. Helps relieve the pain of arthritis and other painful conditions.']
17865	How long do they stay warm?	They are like an electric heating pad - they stay warm as long as you have them turned on.	['Soothes and nourishes skin and nails while replenishing the natural moisture balance in hands. Helps relieve the pain of arthritis and other painful conditions.']
19184	Does this product go on clear and dry fast enough to put clothing over it within a few minutes?	The product is white, but I find that a thin layer works just fine and if applied as a thin layer it will dry clear	['Rugby acne medication 10 percent treatment gel is the strongest benzoyl peroxide gel available. The 10 percent benzoyl peroxide, water based gel is the same maximum strength formula recommended by dermatologists. Rugby acne medication 10 percent gel zooms deep into pores where oil and bacteria live, killing bacteria and zapping zits, delivering the fastest results possible. For treatment and prevention of acne pimples, acne blemishes, blackheads or whiteheads. Rugby acne medication 10 percent treatment gel kills acne causing bacteria. Clears acne pimples and blackheads fast. Oil free, odorless gel vanishes as it clears your skin. The maximum strength formula in rugby acne medication 10 percent treatment gel is the same formula recommended by dermatologists.']
19185	Does it help to lighten dark marks on face as well as get rid of acne?	I do not think that the medication is specifically designed for that purpose. However, I am seeing less dark marks from old acne spots due to the fact that I am not getting new acne and my skin is healing. My skin tone is slowly evening out the longer I go without a breakout, but it takes time.	['Rugby acne medication 10 percent treatment gel is the strongest benzoyl peroxide gel available. The 10 percent benzoyl peroxide, water based gel is the same maximum strength formula recommended by dermatologists. Rugby acne medication 10 percent gel zooms deep into pores where oil and bacteria live, killing bacteria and zapping zits, delivering the fastest results possible. For treatment and prevention of acne pimples, acne blemishes, blackheads or whiteheads. Rugby acne medication 10 percent treatment gel kills acne causing bacteria. Clears acne pimples and blackheads fast. Oil free, odorless gel vanishes as it clears your skin. The maximum strength formula in rugby acne medication 10 percent treatment gel is the same formula recommended by dermatologists.']
19186	What are all of the ingredients?	Active Ingredient: Benzoyl Peroxide 10%... Inactive ingredients: Brij 30, carboner, disopropanolamine, disodium edetate, purified water Call this number for questions... 1-800-645-2158 9:00 to 5:00 ET, Monday thru Friday After using this product, wash well your hands. It stains colors...	['Rugby acne medication 10 percent treatment gel is the strongest benzoyl peroxide gel available. The 10 percent benzoyl peroxide, water based gel is the same maximum strength formula recommended by dermatologists. Rugby acne medication 10 percent gel zooms deep into pores where oil and bacteria live, killing bacteria and zapping zits, delivering the fastest results possible. For treatment and prevention of acne pimples, acne blemishes, blackheads or whiteheads. Rugby acne medication 10 percent treatment gel kills acne causing bacteria. Clears acne pimples and blackheads fast. Oil free, odorless gel vanishes as it clears your skin. The maximum strength formula in rugby acne medication 10 percent treatment gel is the same formula recommended by dermatologists.']
21233	Does this product help one with the area under the eye looking like it's not puffy but sunken in?	Sorry, no. That is the tear trough area and will lose volume as we age. The only fix for that is fillers or plastic surgery. These help with puffiness and skin texture only.	"[""Increases the content of collagen in the skin and provides a strong lifting effect, improves elasticity, smooths wrinkles and intensely moisturizes, slows the aging process and improves blood circulation. As a result, the skin looks rejuvenated and full with vital energy. Biological gold creates the conduction effect and improves skin's ability to absorb active herbal ingredients, ensures long-term moisturizing effect, helps to regenerate skin cells, protects the skin from wrinkle's formation and slows the aging process. It is recommended to apply cosmetics based on bio-gold for those who are 35 years old or older.""]"
21234	Does this product help at all in reducing the appearance of dark circles?	I dont have bad dark circles so im not sure. It works for under eye puffiness and smoothing out the skin so in turn it may as well help the dark circles. Its a great product.	"[""Increases the content of collagen in the skin and provides a strong lifting effect, improves elasticity, smooths wrinkles and intensely moisturizes, slows the aging process and improves blood circulation. As a result, the skin looks rejuvenated and full with vital energy. Biological gold creates the conduction effect and improves skin's ability to absorb active herbal ingredients, ensures long-term moisturizing effect, helps to regenerate skin cells, protects the skin from wrinkle's formation and slows the aging process. It is recommended to apply cosmetics based on bio-gold for those who are 35 years old or older.""]"
21235	why are there no directions for use?	Place under eye and wait 15 minutes	"[""Increases the content of collagen in the skin and provides a strong lifting effect, improves elasticity, smooths wrinkles and intensely moisturizes, slows the aging process and improves blood circulation. As a result, the skin looks rejuvenated and full with vital energy. Biological gold creates the conduction effect and improves skin's ability to absorb active herbal ingredients, ensures long-term moisturizing effect, helps to regenerate skin cells, protects the skin from wrinkle's formation and slows the aging process. It is recommended to apply cosmetics based on bio-gold for those who are 35 years old or older.""]"
21236	Where can I find the ingredient list?	If you go directly to the manufacturer website (new-spa.us) you will find, under this product's title the ingredients. Hope that helps	"[""Increases the content of collagen in the skin and provides a strong lifting effect, improves elasticity, smooths wrinkles and intensely moisturizes, slows the aging process and improves blood circulation. As a result, the skin looks rejuvenated and full with vital energy. Biological gold creates the conduction effect and improves skin's ability to absorb active herbal ingredients, ensures long-term moisturizing effect, helps to regenerate skin cells, protects the skin from wrinkle's formation and slows the aging process. It is recommended to apply cosmetics based on bio-gold for those who are 35 years old or older.""]"
21237	How does the product soak in the eye area? Is it not in some kind of plastic /other holder?	The product feel like wet silicon. I didn't notice much change around my eye area.	"[""Increases the content of collagen in the skin and provides a strong lifting effect, improves elasticity, smooths wrinkles and intensely moisturizes, slows the aging process and improves blood circulation. As a result, the skin looks rejuvenated and full with vital energy. Biological gold creates the conduction effect and improves skin's ability to absorb active herbal ingredients, ensures long-term moisturizing effect, helps to regenerate skin cells, protects the skin from wrinkle's formation and slows the aging process. It is recommended to apply cosmetics based on bio-gold for those who are 35 years old or older.""]"
23803	can we sleep we the gel during the night? thank you	I sleep with the gel on. It will dry and it's not sticky so sleeping with it on is fine. I will of course wash it off in the morning.	['Size: 100 ml Our aloe vera gel is made from organically grown pure, green natural leaves without adding absolutely no chemicals or additives. It is viscous and colorless, and is soluble in water and other organic solvents. The raw gel is cleansed with rose water to remove raw smell which is necessary. Therefore the gel might have a gentle fragrance of rose but it does not change the 100% natural properties of the gel in any way. There are absolutely no chemicals or additives. <b>For everyday use:</b> Simply apply the gel anywhere on the body including face, neck and hands. Let the gel dry. First it turns into a thin flaky white layer. This is normal. Give it some time and it will slowly become a moisturous, transparent and invisible film that supplies nutrients to skin. This film helps protect skin from exposing to harmful dust, sun rays, smoke, exhaust fumes etc. If the initial flakiness bothers you during day time, you can also use it at night time and wash it off in the morning. <br /> For more info on this product please visit our official website www.rootsherbal.com']
23804	Does this stuff really work? I'm trying to go the natural way on removing blemishes from my skin. I've tried everything.	I bought it for my daughter because she had a rash on her face and it took it away quickly. Good stuff	['Size: 100 ml Our aloe vera gel is made from organically grown pure, green natural leaves without adding absolutely no chemicals or additives. It is viscous and colorless, and is soluble in water and other organic solvents. The raw gel is cleansed with rose water to remove raw smell which is necessary. Therefore the gel might have a gentle fragrance of rose but it does not change the 100% natural properties of the gel in any way. There are absolutely no chemicals or additives. <b>For everyday use:</b> Simply apply the gel anywhere on the body including face, neck and hands. Let the gel dry. First it turns into a thin flaky white layer. This is normal. Give it some time and it will slowly become a moisturous, transparent and invisible film that supplies nutrients to skin. This film helps protect skin from exposing to harmful dust, sun rays, smoke, exhaust fumes etc. If the initial flakiness bothers you during day time, you can also use it at night time and wash it off in the morning. <br /> For more info on this product please visit our official website www.rootsherbal.com']
23805	if i keep it in the frig, about how long will it stay fresh?	it should stay fresh for 8 months. but the more you leave it out like I have It can stay fresh for 4 months. just keep it in the fridge.	['Size: 100 ml Our aloe vera gel is made from organically grown pure, green natural leaves without adding absolutely no chemicals or additives. It is viscous and colorless, and is soluble in water and other organic solvents. The raw gel is cleansed with rose water to remove raw smell which is necessary. Therefore the gel might have a gentle fragrance of rose but it does not change the 100% natural properties of the gel in any way. There are absolutely no chemicals or additives. <b>For everyday use:</b> Simply apply the gel anywhere on the body including face, neck and hands. Let the gel dry. First it turns into a thin flaky white layer. This is normal. Give it some time and it will slowly become a moisturous, transparent and invisible film that supplies nutrients to skin. This film helps protect skin from exposing to harmful dust, sun rays, smoke, exhaust fumes etc. If the initial flakiness bothers you during day time, you can also use it at night time and wash it off in the morning. <br /> For more info on this product please visit our official website www.rootsherbal.com']
23806	Does this product need to be kept in the refrigerator? Thanks.	If it is truly natural, pure aloe vera, then I would keep it in the fridge - think of any other fresh vegetable, once it's picked, it needs to be kept in the refrigerator. When I cut and filet fresh aloe from my plant, I also keep it in the fridge.	['Size: 100 ml Our aloe vera gel is made from organically grown pure, green natural leaves without adding absolutely no chemicals or additives. It is viscous and colorless, and is soluble in water and other organic solvents. The raw gel is cleansed with rose water to remove raw smell which is necessary. Therefore the gel might have a gentle fragrance of rose but it does not change the 100% natural properties of the gel in any way. There are absolutely no chemicals or additives. <b>For everyday use:</b> Simply apply the gel anywhere on the body including face, neck and hands. Let the gel dry. First it turns into a thin flaky white layer. This is normal. Give it some time and it will slowly become a moisturous, transparent and invisible film that supplies nutrients to skin. This film helps protect skin from exposing to harmful dust, sun rays, smoke, exhaust fumes etc. If the initial flakiness bothers you during day time, you can also use it at night time and wash it off in the morning. <br /> For more info on this product please visit our official website www.rootsherbal.com']
23807	"Does this has ""Potassium chloride"" ?"	I don't see Potassium Chloride listed on the lable. you can check www.rootsherbal.com for more info	['Size: 100 ml Our aloe vera gel is made from organically grown pure, green natural leaves without adding absolutely no chemicals or additives. It is viscous and colorless, and is soluble in water and other organic solvents. The raw gel is cleansed with rose water to remove raw smell which is necessary. Therefore the gel might have a gentle fragrance of rose but it does not change the 100% natural properties of the gel in any way. There are absolutely no chemicals or additives. <b>For everyday use:</b> Simply apply the gel anywhere on the body including face, neck and hands. Let the gel dry. First it turns into a thin flaky white layer. This is normal. Give it some time and it will slowly become a moisturous, transparent and invisible film that supplies nutrients to skin. This film helps protect skin from exposing to harmful dust, sun rays, smoke, exhaust fumes etc. If the initial flakiness bothers you during day time, you can also use it at night time and wash it off in the morning. <br /> For more info on this product please visit our official website www.rootsherbal.com']
24794	how wide its it?	"Measuring the widest part, it measures about 5 5/8"""	[]
24795	can you tell me the diameter please?	about 10-12 cm	[]
24796	- What are the dimensions of this item?	"The mirror is 4.5 "" in diameter, and the arm when extended sticks out about 3.5 ""."	[]
26219	Is this cap very big?	No. The cap is small	['Black sleeping cap. Satin material with comfortable elastic band.']
26220	I'm looking for something to wear at night when I put oil on my hair. Does this prevent oil from getting on your pillowcase? Thanks	Yes it does keep the pillowcase from getting oil spots. I put olive oil and coconut oil in my hair and I have never had an issue with oil spots.	['Black sleeping cap. Satin material with comfortable elastic band.']
26221	i'm planning on using argan or some type of oil to mosturize my hair and use it as a mask overnight will this cap protect my bed from leaking oil?	Probably, it's just made of cloth.	['Black sleeping cap. Satin material with comfortable elastic band.']
