	question	answer	description
112	Is Carmol #40 available?	Only 10 and 20	['<P><B>CARMOL 20:<BR></B><UL><LI>20% Carbamide Cream.</LI><LI>Enhanced Moisturizer For Rough Dry Skin.</LI><LI>Nonlipid vanishing cream for rough, dry skin, especially on hands, elbows, and heels.</LI><LI>Hypoallergenic, nonocclusive.</LI><LI>Contains no parabens, lanolin or mineral oil.</LI></UL></P>']
114	do you need a prescription?	No a prescription is not required.	['<P><B>CARMOL 20:<BR></B><UL><LI>20% Carbamide Cream.</LI><LI>Enhanced Moisturizer For Rough Dry Skin.</LI><LI>Nonlipid vanishing cream for rough, dry skin, especially on hands, elbows, and heels.</LI><LI>Hypoallergenic, nonocclusive.</LI><LI>Contains no parabens, lanolin or mineral oil.</LI></UL></P>']
687	Can this be used on wet hair?	No, only on dry hair. It is similar to a regular curling iron.	['Helen of Troy 1514 Brush Iron, White, 1 1/2 Inches Barrel']
689	"has anyone else had a lot of the ""brisles"" break off? i just got mine and any time something bumps the bristles they brake."	very much a problem for me. I had a handful break off after a flight and the iron was already missing several spikes!!	['Helen of Troy 1514 Brush Iron, White, 1 1/2 Inches Barrel']
691	Does it work for really long hair? I have fine hair but a lot of it.	I do not have real long hair. It would work fine but I would only take a small section of hair at a time when using this brush cause you may get your hair tangled up in the brush. This is brush is much better than the real expensive brush iron.	['Helen of Troy 1514 Brush Iron, White, 1 1/2 Inches Barrel']
693	wattage of this product?	I believe it's 110. It doesn't blow fuses like other hair tools I have used.	['Helen of Troy 1514 Brush Iron, White, 1 1/2 Inches Barrel']
695	are the bristles soft like a brush or plastic hard	They are soft but also long enough. I don't like styling tools that have really short bristles because it feels like I can't get my hair in them. I like these bristles	['Helen of Troy 1514 Brush Iron, White, 1 1/2 Inches Barrel']
697	Are the bristles longer or shorter. I have ordered a few of these same irons and some have longer bristles and some have shorter bristles.	Short	['Helen of Troy 1514 Brush Iron, White, 1 1/2 Inches Barrel']
699	"Is this a ""dryer"" style. I am looking for just an iron."	This is a curling iron with teeth (brush) it does not dry your hair.	['Helen of Troy 1514 Brush Iron, White, 1 1/2 Inches Barrel']
701	Are the bristles hard or soft and if they are soft bristles, does your hair get tangled?	Bristles are hard and I never get tangled.	['Helen of Troy 1514 Brush Iron, White, 1 1/2 Inches Barrel']
703	You have 2 different styles for 1 1/2 barrel. Are they both the same?	I would never buy this product again. It sparked & burned my hand. Maybe mine was defective, but I decided to pay more and get something more reliable.	['Helen of Troy 1514 Brush Iron, White, 1 1/2 Inches Barrel']
705	Why isn't this product made with stronger bristles that don't easily break?	I wish I knew! I've had a couple break but it was when I dropped the brush accidentally. But that was even on carpet. You wouldn't expect the bristle to break on carpet.	['Helen of Troy 1514 Brush Iron, White, 1 1/2 Inches Barrel']
1069	Does this version come with the atomizer so that it can be sprayed easily?	No it doesn't ... But you can always put in a clean atomizer easily attainable at your local drug store	['Water-Rosewater Heritage Store 8 oz Liquid']
1071	Does this come in a spray bottle?	Hi, the 8oz. is not spray bottle, but you can easy find a replace spray cap from any drug store. I like it and use it every day :)	['Water-Rosewater Heritage Store 8 oz Liquid']
1073	Does this have colorant?	No. I use it for my sensitive skin as a facial toner bc any and everything else I have ever tried does not work...I am very very sensitive to chemicals, so this all natural product is perfect for me.	['Water-Rosewater Heritage Store 8 oz Liquid']
1075	Is the bottle labeled as pure natural essence or aromatherapy mist?	Aromatherapy Water... Vor-mag water (water that's been vortexed and magnetized to raise energy to a higher vibration, that they believe to be more beneficial), and Rosa Damascena (Hydroessential Rose) flower oil. Pesticide free!	['Water-Rosewater Heritage Store 8 oz Liquid']
1077	Does it attract Pest, bugs, etc. indoors and outdoors?	No it doesn't.	['Water-Rosewater Heritage Store 8 oz Liquid']
1079	Can I drink it?	No, we cannot advise you to drink it. Only follow the directions: Directions: Use as a perfume, body splash or add to your hair rinse or bath water. You can also combine with therapeutic oils to make your own unique complexion formula.	['Water-Rosewater Heritage Store 8 oz Liquid']
1081	Could this product be used to lighten skin?	No	['Water-Rosewater Heritage Store 8 oz Liquid']
1085	Is this food grade?	no	['Water-Rosewater Heritage Store 8 oz Liquid']
1087	is this the pure essence rose water or the aromatherapy mist?	It is water and rose flower oil. I use it in the facial toner I make and it's wonderful. ~ k8	['Water-Rosewater Heritage Store 8 oz Liquid']
1445	is this a round tall bottle?	The bottle is oblong or oval shaped at the bottom. I think this design allows for larger ounce of parfum but the bottle is not tall; true to the picture. I was satisfied for the amount in lieu of the low cost of this item.	[]
1449	So the Eau De Toilette is weaker than the regular Pour Homie?	As with most colognes, eau de toilette/parfum, the women's version is more subtle, not weaker. It is a wonderful scent.	[]
1451	i want to make sure this cologne is real ?	we only sell authentic fragrances	[]
1453	I saw some reviews revealing that this product might be fake. Can anyone confirm or deny this?	Hello please be advised all of our merchandise is 100 percent. We order directly from the manufacture and we have over 300 stores with in the untied states	[]
1455	Does it come wrapped in cellophane? You know, is it a sealed box?	Yes it does. It comes just like you would purchase it in the store. Very happy with product.	[]
1457	Is this the real perfume or a generic?	It's the real thing not a fake. But it is a toilette spray like it says. Hope this was helpful.	[]
1459	size	3.4 Ounces	[]
1461	is this 50 mil or 100?	It's the biggest size. So I guess it's 100 ml	[]
1463	is this really made by bulgary or is it a copy?	It was the REAL thing when I purchased it. Wonderful fragrance.	[]
3140	The Red Door listed says EDT and the box is for the Parfum. I need the EDP. Which is it? Is it authentic, not a knockoff?	"I actually ordered the Parfum (the one that said ""Parfum"" in the description), and that is what I got, no matter what the picture was. I have to say, I really didn't pay that much attention to what the box said in the picture, only the description wording. So, if it says Eau de Toilette, I would tend to believe it. The Parfum is the very same as what I pay a lot more for at Macy's or Kohl's. The smell is exactly the same and it has the same longevity of smell when wearing it."	['Introduced in 1989. Fragrance notes are red roses and orchids blend with other exotic flowers honey and spice, very sensual. Recommended use for romantic wear.']
3141	Dear handytc, Is this newer version with square top or older version with rounded top? Thx	I Don't recall my wife said it was fake and tossed it.	['Introduced in 1989. Fragrance notes are red roses and orchids blend with other exotic flowers honey and spice, very sensual. Recommended use for romantic wear.']
3142	I'm form Brazil. Do you send for me, if i buy?	Maria, We are happy to inform you that we do ship to Brazil. Please contact me directly if you need any assistance. Thank you, Customer Care My Pleasure Box	['Introduced in 1989. Fragrance notes are red roses and orchids blend with other exotic flowers honey and spice, very sensual. Recommended use for romantic wear.']
3143	Does anyone know if this fragrance is similar to perfume Revlon Intimate, made many years ago?	I have never smelled Intimate, but Red Door smells like really sexy flowers. It not heavy, but a light smell of jasmine. Everyone has told me how it reminds them of walking in a small flower garden with butterflies.	['Introduced in 1989. Fragrance notes are red roses and orchids blend with other exotic flowers honey and spice, very sensual. Recommended use for romantic wear.']
3144	Is this the original formula or the new version	The original formula but a new bottle. The bottle is a red door. The smell is awesome. I've been buying this for 10 years and I refuse to let myself run out	['Introduced in 1989. Fragrance notes are red roses and orchids blend with other exotic flowers honey and spice, very sensual. Recommended use for romantic wear.']
3145	I see 2 different looking 3.3 Red Door spray bottles and they are both called the very same thing. What is the difference?	There is a new line in a pink bottle called Red Door Revealed. The original bottle of Red Door is in the red colored package. Also, there is a perfume and a cologne spray. The perfume is highly concentrated verses the cologne. I hope this helps. :)	['Introduced in 1989. Fragrance notes are red roses and orchids blend with other exotic flowers honey and spice, very sensual. Recommended use for romantic wear.']
3146	I didn't major in math but, doesn't $2.45 per ounce x 3.3 ounces = $8.09 rater than $39.37?	We sell this product as follows Red Door By Elizabeth Arden Womens Eau De Toilette (EDT) Spray .85 oz for $19.99 we do not advertise price per ounce so I cannot answer for other sellers. Thank you, TopBeautySupply	['Introduced in 1989. Fragrance notes are red roses and orchids blend with other exotic flowers honey and spice, very sensual. Recommended use for romantic wear.']
3147	Tell me if this is eau de parfum spray or toilette?	nope	['Introduced in 1989. Fragrance notes are red roses and orchids blend with other exotic flowers honey and spice, very sensual. Recommended use for romantic wear.']
3148	what is the difference between the perfume and the toilette spray	Toilette Spray or water is less concentrated than perfume. It regularly contains 1-7% concentration of perfume if I remember correctly. In a way, it's like body spray.While Eau de Parfume has around 8-16% perfume and lasts a lot longer. Perfume is just the concentrate, which in my opinion is the best.	['Introduced in 1989. Fragrance notes are red roses and orchids blend with other exotic flowers honey and spice, very sensual. Recommended use for romantic wear.']
3149	I am from Ecuador and I see that the price is $31.47. Is this correct?	Yes	['Introduced in 1989. Fragrance notes are red roses and orchids blend with other exotic flowers honey and spice, very sensual. Recommended use for romantic wear.']
3203	Did this kits come with bottles of gel or powder or wax remover?	it comes with about 5 different bottles of stuff: pre-wax cleanser, post wax cooling gel, post wax moisturizer, slow grow oil, concealor. it does not come with powder or wax remover. However, I find that plain old baby oil works great as a wax remover and baby powder is a great friction barrier - both are cheap and readily available at any store. Pretty much everything pictured is what comes in the kit (nothing more, nothing less).	['', '<strong>GiGi Mini Pro Hair Removal Waxing Kit</strong> is the ideal starter kit for the beginners in hair waxing or the price conscious professional. This kit contains all the necessary waxing essentials for a complete professional service. When you are ready to expand your salon menu to include profitable waxing services, <strong>GiGi Mini Pro Hair Removal Waxing Kit</strong> is the perfect choice.', '<strong>GiGi Mini Pro Hair Removal Waxing Kit includes:</strong>']
3204	I'm looking for Hard wax. Does this machine come with that?	This order does not come with hard wax but you can purchase it separately.	['', '<strong>GiGi Mini Pro Hair Removal Waxing Kit</strong> is the ideal starter kit for the beginners in hair waxing or the price conscious professional. This kit contains all the necessary waxing essentials for a complete professional service. When you are ready to expand your salon menu to include profitable waxing services, <strong>GiGi Mini Pro Hair Removal Waxing Kit</strong> is the perfect choice.', '<strong>GiGi Mini Pro Hair Removal Waxing Kit includes:</strong>']
3205	I bought the GiGi all purpose honee wax for the warmer. How long should i let it heat up before use?	My instructions said to heat the wax for 15 to 20 minutes but it took a lot longer, more than 30 minutes. Just keep checking back until it's all melted but not too hot.	['', '<strong>GiGi Mini Pro Hair Removal Waxing Kit</strong> is the ideal starter kit for the beginners in hair waxing or the price conscious professional. This kit contains all the necessary waxing essentials for a complete professional service. When you are ready to expand your salon menu to include profitable waxing services, <strong>GiGi Mini Pro Hair Removal Waxing Kit</strong> is the perfect choice.', '<strong>GiGi Mini Pro Hair Removal Waxing Kit includes:</strong>']
3206	Is this battery operated or does it have a cord?	Cord	['', '<strong>GiGi Mini Pro Hair Removal Waxing Kit</strong> is the ideal starter kit for the beginners in hair waxing or the price conscious professional. This kit contains all the necessary waxing essentials for a complete professional service. When you are ready to expand your salon menu to include profitable waxing services, <strong>GiGi Mini Pro Hair Removal Waxing Kit</strong> is the perfect choice.', '<strong>GiGi Mini Pro Hair Removal Waxing Kit includes:</strong>']
3207	Does wax wipe up easily with water or do i need a certain oil to clean it off? I am thinking of accidents.	I just use baby oil and it works fine. The kit doesn't have the brow powder though so make sure that you get that too.	['', '<strong>GiGi Mini Pro Hair Removal Waxing Kit</strong> is the ideal starter kit for the beginners in hair waxing or the price conscious professional. This kit contains all the necessary waxing essentials for a complete professional service. When you are ready to expand your salon menu to include profitable waxing services, <strong>GiGi Mini Pro Hair Removal Waxing Kit</strong> is the perfect choice.', '<strong>GiGi Mini Pro Hair Removal Waxing Kit includes:</strong>']
3208	I can't find the information in each product, can you specify each product that comes in this kit and its weight?	It comes with the wax warmer it accommodates any wax cream from 8oz-14oz. The box already comes with a creme wax of 14 oz. It also includes Pre Hon, pre wash cleaner 2 oz. Slow grow, hair minimizer 2 oz. Post Epilation, skin moisturizer 2 oz. Post Wax Cooling Gel, skin freshener 2 oz. Post Wax Concelealer, skin foundation 2 oz. It also includes clean collars and spatula 10 of the 3 sizes it shows in the picture. Everything comes as it shows and is very easy to used.	['', '<strong>GiGi Mini Pro Hair Removal Waxing Kit</strong> is the ideal starter kit for the beginners in hair waxing or the price conscious professional. This kit contains all the necessary waxing essentials for a complete professional service. When you are ready to expand your salon menu to include profitable waxing services, <strong>GiGi Mini Pro Hair Removal Waxing Kit</strong> is the perfect choice.', '<strong>GiGi Mini Pro Hair Removal Waxing Kit includes:</strong>']
3209	what is the best wax to use?	It depends on where you want to wax on your body. I use more of a course wax for my eyebrows. I found that that wax that came with it was to soft for me.	['', '<strong>GiGi Mini Pro Hair Removal Waxing Kit</strong> is the ideal starter kit for the beginners in hair waxing or the price conscious professional. This kit contains all the necessary waxing essentials for a complete professional service. When you are ready to expand your salon menu to include profitable waxing services, <strong>GiGi Mini Pro Hair Removal Waxing Kit</strong> is the perfect choice.', '<strong>GiGi Mini Pro Hair Removal Waxing Kit includes:</strong>']
3210	Is this an 8 or 14 ounce warmer?	It is a 14 oz warmer. It works great. I would recommend ordering some non woven strips. The woven strips that it comes with are awful with the cream wax. I also ended up ordering the honey wax.	['', '<strong>GiGi Mini Pro Hair Removal Waxing Kit</strong> is the ideal starter kit for the beginners in hair waxing or the price conscious professional. This kit contains all the necessary waxing essentials for a complete professional service. When you are ready to expand your salon menu to include profitable waxing services, <strong>GiGi Mini Pro Hair Removal Waxing Kit</strong> is the perfect choice.', '<strong>GiGi Mini Pro Hair Removal Waxing Kit includes:</strong>']
3211	Do you ship to Hawaii	They do not ship to Hawaii	['', '<strong>GiGi Mini Pro Hair Removal Waxing Kit</strong> is the ideal starter kit for the beginners in hair waxing or the price conscious professional. This kit contains all the necessary waxing essentials for a complete professional service. When you are ready to expand your salon menu to include profitable waxing services, <strong>GiGi Mini Pro Hair Removal Waxing Kit</strong> is the perfect choice.', '<strong>GiGi Mini Pro Hair Removal Waxing Kit includes:</strong>']
3212	Do you ship to Hawaii	We unfortunately don't ship to Hawaii. bebeautiful	['', '<strong>GiGi Mini Pro Hair Removal Waxing Kit</strong> is the ideal starter kit for the beginners in hair waxing or the price conscious professional. This kit contains all the necessary waxing essentials for a complete professional service. When you are ready to expand your salon menu to include profitable waxing services, <strong>GiGi Mini Pro Hair Removal Waxing Kit</strong> is the perfect choice.', '<strong>GiGi Mini Pro Hair Removal Waxing Kit includes:</strong>']
3221	can i use the red clay powder for homemade cp soap/	I haven't tried it myself but from what I read online you definitely can ;)	['100% Pure Facial Detox/Sensitive Skin Types Condition: Sensitive Skin in need of detoxification to remove impurities and in need of a smaller pore size and tighter skin tone. Solution: Moroccan Red Clay is an all-natural powder clay that is highly absorbent and mixes easily with water and other moisturizing products. It serves as an excellent facial cleanser and purifying masque, especially for individuals with sensitive skin.']
3222	is this rhassoul clay?	No, it's red Moroccan clay.	['100% Pure Facial Detox/Sensitive Skin Types Condition: Sensitive Skin in need of detoxification to remove impurities and in need of a smaller pore size and tighter skin tone. Solution: Moroccan Red Clay is an all-natural powder clay that is highly absorbent and mixes easily with water and other moisturizing products. It serves as an excellent facial cleanser and purifying masque, especially for individuals with sensitive skin.']
3224	Can you use this in your hair to make hair wash powder?	I mix it in a bowl and stir with a wooden spoon because a metal spoon would ruin the nutrients of the powder. Try mixing with oil or coconut milk to get a smoother texture and make it easier to spread. I have natural, coily and dense hair. Just make sure to rinse thoroughly!	['100% Pure Facial Detox/Sensitive Skin Types Condition: Sensitive Skin in need of detoxification to remove impurities and in need of a smaller pore size and tighter skin tone. Solution: Moroccan Red Clay is an all-natural powder clay that is highly absorbent and mixes easily with water and other moisturizing products. It serves as an excellent facial cleanser and purifying masque, especially for individuals with sensitive skin.']
3225	What are the main differences between this red clay and the european clay?	I dont know the diff nore have I used the other.one but the red clay is awesome if u use every. Other day	['100% Pure Facial Detox/Sensitive Skin Types Condition: Sensitive Skin in need of detoxification to remove impurities and in need of a smaller pore size and tighter skin tone. Solution: Moroccan Red Clay is an all-natural powder clay that is highly absorbent and mixes easily with water and other moisturizing products. It serves as an excellent facial cleanser and purifying masque, especially for individuals with sensitive skin.']
3226	Is this good for making lipstick, I've used beet powder which doesn't work. Recipe suggests Australian Red Reef Clay ...	I am not sure. When I mix this with water it is a rust color. It may also dry out if used and it is wet unless a moisture agent is introduced.	['100% Pure Facial Detox/Sensitive Skin Types Condition: Sensitive Skin in need of detoxification to remove impurities and in need of a smaller pore size and tighter skin tone. Solution: Moroccan Red Clay is an all-natural powder clay that is highly absorbent and mixes easily with water and other moisturizing products. It serves as an excellent facial cleanser and purifying masque, especially for individuals with sensitive skin.']
3227	Is this okay for after shaving	It CAN be. This depends on a) how temperamental your skin is and b) where (what area of your body) you are going to use it on. You won't have much use of it, let's say, on your legs or underarms. On the face, you should first test it - there is nothing in here that should provoke an irritation, BUT, some people's skin is sensitive after shaving. So try it on your cheek or chin first, and try it before, and after, shaving. One might work better for you than the other. Also, I am not sure what you expect from this product, but keep in mind that it is for deep-cleansing and shrinking pores. I find that it also firms and tightens my face a bit, and smoothies out any bumps on my upper arms and chest.	['100% Pure Facial Detox/Sensitive Skin Types Condition: Sensitive Skin in need of detoxification to remove impurities and in need of a smaller pore size and tighter skin tone. Solution: Moroccan Red Clay is an all-natural powder clay that is highly absorbent and mixes easily with water and other moisturizing products. It serves as an excellent facial cleanser and purifying masque, especially for individuals with sensitive skin.']
3229	how effective is this on whiteheads?	Never got it	['100% Pure Facial Detox/Sensitive Skin Types Condition: Sensitive Skin in need of detoxification to remove impurities and in need of a smaller pore size and tighter skin tone. Solution: Moroccan Red Clay is an all-natural powder clay that is highly absorbent and mixes easily with water and other moisturizing products. It serves as an excellent facial cleanser and purifying masque, especially for individuals with sensitive skin.']
4646	Hi! If you have a tendency to breakout is this okay?Is it better to use the 10% lotion rather than12&#x2105;souffle?I have lines&amp;acne:((Advice appreciated.	Start with the 10% and after you go through the product than move up to 12%. I have combo/oily skin and also sensitive to break out. This product works good for me. If you have a breakout that you messed with, this will sting a tad when it enters the poped zit. It is a acid- so if you sweat it off and it runs into your eyes it may also burn- so I apply before bedtime and it does not discolor my pillow cases.	['<b> Renew Your Skin with Anti-Wrinkle Souffle </b><br>', 'Now you can enjoy velvety soft skin by using Alpha Hydrox 12% Glycolic AHA Souffle. It can reduce fine lines and wrinkles and therefore soften and restore your skin. It contains 12% Glycolic AHA to make your skin more radiant, offer improved texture and elasticity.']
4647	Does this come in a tube or jar?	It comes in a tube. I know, the seller needs to update the picture. The manufacturer has gone to the tubes only for this product.	['<b> Renew Your Skin with Anti-Wrinkle Souffle </b><br>', 'Now you can enjoy velvety soft skin by using Alpha Hydrox 12% Glycolic AHA Souffle. It can reduce fine lines and wrinkles and therefore soften and restore your skin. It contains 12% Glycolic AHA to make your skin more radiant, offer improved texture and elasticity.']
4648	pha cream or serum	I would definitely recommend the cream. The serum tends to rub off and not absorb into the skin as well. This AHA cream is really excellent, by the way, in case you haven't tried it. Two nights' use and you will see your skin clarity and evenness improve! I love it!	['<b> Renew Your Skin with Anti-Wrinkle Souffle </b><br>', 'Now you can enjoy velvety soft skin by using Alpha Hydrox 12% Glycolic AHA Souffle. It can reduce fine lines and wrinkles and therefore soften and restore your skin. It contains 12% Glycolic AHA to make your skin more radiant, offer improved texture and elasticity.']
4649	IS this a moistureizer?? Do I need a moisturizer after this product ?	It's not a moisturizer. You need to moisturize after.	['<b> Renew Your Skin with Anti-Wrinkle Souffle </b><br>', 'Now you can enjoy velvety soft skin by using Alpha Hydrox 12% Glycolic AHA Souffle. It can reduce fine lines and wrinkles and therefore soften and restore your skin. It contains 12% Glycolic AHA to make your skin more radiant, offer improved texture and elasticity.']
4650	Can this be used around the eyes and on eye lids?	I would not use an AHA around the eyes or sensitive skin areas, but it is fine to use on other areas of the face.	['<b> Renew Your Skin with Anti-Wrinkle Souffle </b><br>', 'Now you can enjoy velvety soft skin by using Alpha Hydrox 12% Glycolic AHA Souffle. It can reduce fine lines and wrinkles and therefore soften and restore your skin. It contains 12% Glycolic AHA to make your skin more radiant, offer improved texture and elasticity.']
