	question	answer	description
26222	What material is the cap made of? Is it a polyester or a silk? Satin refers to how the fabric is weaved - not the material.Thanks	Didn't even realize that. It is a polyester cap for sure. I bought a satin one,that was satin for sure . I'll try to locate it . Just run that by a request fr a satin sleep cap on Amazon again. Good luck. I just went to Amazon typed in shirley	['Black sleeping cap. Satin material with comfortable elastic band.']
27193	does it contain cocamide?	No, here are the Ingredients: Purified Water, Saponified Olive Oil & Coconut Oil, Vegetable Glycerin, Olive Leaf Extract, Ginger Extract, Honey, *Comfrey Root Extract, Niacin (Vitamin B3), Lavender Oil, Lemon Grass Oil, *Burdock Root Extract, *Rosemary Extract, *Grape Seed Extract, d-Biotin.* (Certified Organic)	['Natural Shampoo with Kukui Nut Oil. Natural Lavender Scent.']
27194	"How do we know that the ingredient labeled ""coconut oil"" is not a cover for SLS or one of its relatives?"	Saponified Coconut Oil is a process where they mix coconut oil with an alkaline substance (such as lye) to create soap. This is how soaps are made. (I trust them, but the only way to know for sure is to visit their factory or have a chemist do an analysis)	['Natural Shampoo with Kukui Nut Oil. Natural Lavender Scent.']
27195	Is this product Gluten free ??	No, it does NOT contain gluten, there are no wheat ingredients. By the way my family and I love this shampoo! Enjoy.	['Natural Shampoo with Kukui Nut Oil. Natural Lavender Scent.']
27196	Are the essential oils you use free of propylene glycol?	"The bottle says, ""free of propylene glycol."" Nice shampoo and conditioner."	['Natural Shampoo with Kukui Nut Oil. Natural Lavender Scent.']
27197	"I can easily get static when I use ""natural"" shampoo. Does anybody have static issues with this? Do I need to use the conditioner?"	I don't get static issues. My hair is easily to tangle. I use the hair detangler after my hair dry. I need some kind of conditioner to comb my hair.	['Natural Shampoo with Kukui Nut Oil. Natural Lavender Scent.']
27198	Is it suitable for oily hairs?	Yes.	['Natural Shampoo with Kukui Nut Oil. Natural Lavender Scent.']
27199	"I noticed you changed the ingredient list very recently (why?). The bottle no longer states ""chemical-free"", Is the new formulation free of chemicals?"	"Hi Pen, I am a user and you right. Currently the front image is not having the label statement ""Chemical-Free . pH Balanced""; the same in the label below. Also there is other change in the lowest label instead of saying ""with Coconut Oil"" now says ""with KuKui Oil"". That indicates that they changed the original formulation. I have still a bottle saying the original descriptions. Chemical-Free is the main reason for me to buy this product. While they keep guaranteed that this product is pH-balanced and continue having No SLS and Organic Ingredients also no animal or human cruelty tests I will continue buying it otherwise they will lose a great customer. Regards..."	['Natural Shampoo with Kukui Nut Oil. Natural Lavender Scent.']
27200	Does this shampoo contain alcohol	Hi J., As per the bottle I have in my hands now there is nothing indicating that this shampoo contains alcohol. And I used it very often and I sensed no alcohol. The Ingredients are: Aqueous solution of Purified Water, Saponified *Coconut & *Olive Oils, Kukui Nut Oil, *Olive Leaf Extract, *Ginger Extract, *Honey, *Comfrey Root Extract, Lavender Oil, Vitamin B3, *Burdock Root Extract, *Grape Seed Extract, *Rosemary Extract, & d-Biotin; Coco-glucoside (from coconut oil), Vegetable Glycerin, Xanthan Gum. * (Certified Organic). I hope this information helps you. Regards...	['Natural Shampoo with Kukui Nut Oil. Natural Lavender Scent.']
27201	How long does this last? Does it have a expiration date?	That is a good question. So far my supply has lasted six months. But a competitors' natural shampoo purchased to trial has started to turn rancid. Hence my comment of good question as I just noticed that the other day when I thought I really ought to use that other brand shampoo up and noticed the objectionable smell while shampooing. So you definitely have 6 months. I still have 3 bottles form the same batch unopened so probably can extend that to 8-9 months testing before supply exhausts.	['Natural Shampoo with Kukui Nut Oil. Natural Lavender Scent.']
27202	How is this for dandruff control?	Not really sure, but I don't think it's meant to be a dandruff control product.	['Natural Shampoo with Kukui Nut Oil. Natural Lavender Scent.']
27349	can this hair be dyed ?	This has is terrible it's not real try genesis virgin hair	"['Unprocessed 100% Virgin Brazilian Human Hair Guaranteed / 100 grams / 1 pack Hair wavy or straight /with cuticles 16"" Black 1b can be colorized to your liking. We test hair strands of our unprocessed hair to make sure that takes color because if it does not its a good chance that it contains synthetic fibers or its been processed. Thanks for your interest in Zayn products.']"
27350	Is The 20 Inches Really 20?	"Hi, I can't say if the 20"" is really 20 inches because I only purchased the 16""...and it was not 16"". The seller contacted me in an attempt to get me to reversre my negative comment, and I would not...so it seems the name they distributed under may have changed...I would be very cautious because the hair is high quality, but the track is not... even if you are going to use bonding on it it is thick and bulky..."	"['Unprocessed 100% Virgin Brazilian Human Hair Guaranteed / 100 grams / 1 pack Hair wavy or straight /with cuticles 16"" Black 1b can be colorized to your liking. We test hair strands of our unprocessed hair to make sure that takes color because if it does not its a good chance that it contains synthetic fibers or its been processed. Thanks for your interest in Zayn products.']"
27351	Price: Is it $90 per bundle?	NO. $46 per bundle. I just bought 2 bundles. its great!	"['Unprocessed 100% Virgin Brazilian Human Hair Guaranteed / 100 grams / 1 pack Hair wavy or straight /with cuticles 16"" Black 1b can be colorized to your liking. We test hair strands of our unprocessed hair to make sure that takes color because if it does not its a good chance that it contains synthetic fibers or its been processed. Thanks for your interest in Zayn products.']"
27938	I am having trouble finding this product in France. Any chance you ship internationally?	Yes we ship internationally, however it is best to shop directly on our site, you can still pay using your Amazon account.	[]
27939	is this 100% natural or organic zinc oxide? Is it nano-particle or non nano particle?	"Zinc Oxide is man made, so I don't know that it could ever be called ""organic"" or ""natural"". But, is it safe? 500 years of history says yes, just do not breath in the dust. When I ordered it, I remember that the particle size listed here was too big to penetrate pores, but it wasn't labeled ""non-nano"". To find one that is certainly non-nano, I'd go to soapgoods.com and type zinc oxide into their search."	[]
27940	Is this a non-nano zinc oxide?	"200-1000 nm. I use it for lip balm and add a tint of color so you don't see the ""white"". In sunscreen I don't mind the white"	[]
27941	"I live in Belgium and I tried to place an order, it says: ""We do not deliver the following products in the given country"". Why is this?"	Hello Suzanna, This could be because we so not ship to international countries through Amazon. We do ship internationally through our website makingcosmetics.com You can create an account with an email and password, you would then be able to shop for ingredients and see the shipping prices. You might also check with your local customs office and see if there are any restrictions when trying to import ingredients into your country. Regards, Making Cosmetics	[]
27942	is this product a non nano zinc oxide or synthetic?	This is 100% natural occuring zinc oxide. It is cosmetic grade. It is not synthetic. Hope this helps. :)	[]
27943	What's the wash-off-ability of this powder, if added straight 2 skin? Wash off thorougly w/soap/cleanser, w/no residue? Pls help thx.	I wouldn't advise to add the powder straight to skin, since breathing in the particles is not healthful. It may leave some white residue, but i use a loofah face sponge with cleanser which does a good job at removing it.	[]
27944	What is the mean particle size of this product? Is it less than 100 nm?	"Hello there. To answer your question, no the mean particle size is NOT less than 100 nm. I searched for a few days to find a product that had a particle size of LARGER than 100nm. If you scroll down, under ""product description"" it states: ""Produced from naturally occurring zinc ore, super purity (free from other metals). Cosmetic grade particle size 200-1000 nanometer (nm) or 0. 2-1 micrometer)."""	[]
27945	Is there any lead in this product?	"The ingredient only stated ""Produced from naturally occurring zinc ore, super purity (free from other metals) Particle size &lt;1000 nm "" Hope that helps."	[]
27946	This is zinc oxide POWDER, right?	Yes, we just made a few sunscreens for summer and this worked great!	[]
27947	Still confused - is this nano? or non-nano? The answers had me confused. Somebody please answer! I thought micronized meant it was nano particular	I bought this to make sunscreen for my kids. Recommended from Wellnessmama.com who makes all sorts of recipes for her own family. From what I found, it's non nano.	[]
28404	What are all the ingredients?	My jar says: Coconut oil, Amber colloidal silver, gelling agent, and ph balancer. It does not list what the gell and balancer are specifically, but my skin is sensitive, and it does not irritate, but soothes and heals. I use it on my face for adult acne and some brown spots, which are bettered with even occasional use of this cream. The amber silver strength is supposed to be a better quality too. I really like using it.	['Optimised Energetics are committed to offering the finest quality Colloidal Silver products with the greatest choice and value anywhere. We use medical grade equipment in our production process which ensures a well regulated and consistent ionic and colloidal solution. We have the widest range of formulations with 10, 20 and True 80% Colloidal Silver Solutions. We also produce our own effective, non sticky and soothing Balms and Salves. All contain our best colloidal silver and some also include moisturising organic coconut oil and essential, calming Bergamot oil. Try our Enhanced Colloidal Silver as an alternative treatment for a wide range of viral, fungal or bacterial conditions.']
28405	Hi, what does the 80% stand for? What is the silver content (I guess it would be in ppm)?	When silver has a ppm designation it is referring to ionic silver which contains nano particles of silver. True 80% plus colloidal silver has larger silver particles that are made from 20ppm ionic silver using a reducing agent and we call this Amber Silver. We have found that Amber silver is more successful when used in creams and gels.	['Optimised Energetics are committed to offering the finest quality Colloidal Silver products with the greatest choice and value anywhere. We use medical grade equipment in our production process which ensures a well regulated and consistent ionic and colloidal solution. We have the widest range of formulations with 10, 20 and True 80% Colloidal Silver Solutions. We also produce our own effective, non sticky and soothing Balms and Salves. All contain our best colloidal silver and some also include moisturising organic coconut oil and essential, calming Bergamot oil. Try our Enhanced Colloidal Silver as an alternative treatment for a wide range of viral, fungal or bacterial conditions.']
28406	Any propylene glycol, parabens, or preservatives?	Hi Elizabeth, no propylene glycol or parabens but it does contain a preservative.	['Optimised Energetics are committed to offering the finest quality Colloidal Silver products with the greatest choice and value anywhere. We use medical grade equipment in our production process which ensures a well regulated and consistent ionic and colloidal solution. We have the widest range of formulations with 10, 20 and True 80% Colloidal Silver Solutions. We also produce our own effective, non sticky and soothing Balms and Salves. All contain our best colloidal silver and some also include moisturising organic coconut oil and essential, calming Bergamot oil. Try our Enhanced Colloidal Silver as an alternative treatment for a wide range of viral, fungal or bacterial conditions.']
28407	I have an English Bull Terrier with severe skin allergies. Can this be used on his paws even if he tries to lick it off?	It says 'for topical use only' but is basically just coconut oil w/ colloidal silver.	['Optimised Energetics are committed to offering the finest quality Colloidal Silver products with the greatest choice and value anywhere. We use medical grade equipment in our production process which ensures a well regulated and consistent ionic and colloidal solution. We have the widest range of formulations with 10, 20 and True 80% Colloidal Silver Solutions. We also produce our own effective, non sticky and soothing Balms and Salves. All contain our best colloidal silver and some also include moisturising organic coconut oil and essential, calming Bergamot oil. Try our Enhanced Colloidal Silver as an alternative treatment for a wide range of viral, fungal or bacterial conditions.']
28408	ppm?	Parts per million?	['Optimised Energetics are committed to offering the finest quality Colloidal Silver products with the greatest choice and value anywhere. We use medical grade equipment in our production process which ensures a well regulated and consistent ionic and colloidal solution. We have the widest range of formulations with 10, 20 and True 80% Colloidal Silver Solutions. We also produce our own effective, non sticky and soothing Balms and Salves. All contain our best colloidal silver and some also include moisturising organic coconut oil and essential, calming Bergamot oil. Try our Enhanced Colloidal Silver as an alternative treatment for a wide range of viral, fungal or bacterial conditions.']
28585	What are the different types of brushes? Like can u go down the line and label each brush? im not exactly sure	There's a eye liner brush, eye shadow brush, brow brush, cancealer brush, angled brush, large shader brush, medium angled brush and a blush brush. Its a awesome kit.	"[""Color:Gold<br>Big eyes and long eyelashes are important parts in a beautiful look. Many girls have to apply thick mascara or stick false eyelashes for longer eyelashes, do you have the same trouble as them?<br>-False eyelashes: glues are harmful to the eyelids and may cause pore necrosis.<br>-Mascara: remover is difficult and may make eyelashes / eyebrows fragile and easier to break.<br>-Eyelashes extension / tattoo eyebrows: high cost and may do harm to the original eyelashes / eyebrows.<br><br>Now, stop hurting your eyelashes / eyebrows. Let the Fiery Youth eyelash growth serum give you 100% REAL and HEALTHY eyelashes.<br><br>FUNCTIONS<br>-Protect eyelashes: Prevent damage caused by the external environment, strong eyelashes / eyebrow roots to prevent shedding.<br>-Deeply energize hair follicles: Repair hair follicles caused by sticky false eyelashes, grafted eyelashes and tattoos.<br>-Consolidate the skin base: Soften and purify the base skin around the eyelashes/eyebrows and improve the eyelash base environment.<br>-Nourishing and moisturizing:Provide sufficient nourishment for eyelashes/eyebrows to accelerate the growth of eyelashes/eyebrows.<br>-Gentle and non-irritating: Contain a variety of natural plant extracts, mild, safe, non- irritating.<br><br>INSTRUCTIONS<br>Apply it 1-2 times a day. After cleansing your face, apply the eyelash growth liquid evenly to the base of upper and lower eyelashes, or the eyebrows.<br><br>GREAT RESULTS <br>After using it regularly, users will notice a 20% increase in the thickness and length of eyelashes after 4-6 weeks, and a 50% increase after 60 days.<br><br>GUARANTEE<br>A small portion of users may not respond to the formula. If you are not satisfied after using this product uninterruptedly for 60 days as recommended, feel free to contact us for 100% REFUND. There is literally no risk for you, so don't hesitate to try our eyelash serum.""]"
28586	Are they soft???	They are. The fluffy brush especially. The smaller brushes are soft yet firm enough to apply correctly. If that makes sense. Hope that helps.	"[""Color:Gold<br>Big eyes and long eyelashes are important parts in a beautiful look. Many girls have to apply thick mascara or stick false eyelashes for longer eyelashes, do you have the same trouble as them?<br>-False eyelashes: glues are harmful to the eyelids and may cause pore necrosis.<br>-Mascara: remover is difficult and may make eyelashes / eyebrows fragile and easier to break.<br>-Eyelashes extension / tattoo eyebrows: high cost and may do harm to the original eyelashes / eyebrows.<br><br>Now, stop hurting your eyelashes / eyebrows. Let the Fiery Youth eyelash growth serum give you 100% REAL and HEALTHY eyelashes.<br><br>FUNCTIONS<br>-Protect eyelashes: Prevent damage caused by the external environment, strong eyelashes / eyebrow roots to prevent shedding.<br>-Deeply energize hair follicles: Repair hair follicles caused by sticky false eyelashes, grafted eyelashes and tattoos.<br>-Consolidate the skin base: Soften and purify the base skin around the eyelashes/eyebrows and improve the eyelash base environment.<br>-Nourishing and moisturizing:Provide sufficient nourishment for eyelashes/eyebrows to accelerate the growth of eyelashes/eyebrows.<br>-Gentle and non-irritating: Contain a variety of natural plant extracts, mild, safe, non- irritating.<br><br>INSTRUCTIONS<br>Apply it 1-2 times a day. After cleansing your face, apply the eyelash growth liquid evenly to the base of upper and lower eyelashes, or the eyebrows.<br><br>GREAT RESULTS <br>After using it regularly, users will notice a 20% increase in the thickness and length of eyelashes after 4-6 weeks, and a 50% increase after 60 days.<br><br>GUARANTEE<br>A small portion of users may not respond to the formula. If you are not satisfied after using this product uninterruptedly for 60 days as recommended, feel free to contact us for 100% REFUND. There is literally no risk for you, so don't hesitate to try our eyelash serum.""]"
28587	is the shiping free	depends which seller you select - see the box on the right side of the page. Some of the items have choices, some of which offer free shipping, some don't. Plus that offer can change at any time	"[""Color:Gold<br>Big eyes and long eyelashes are important parts in a beautiful look. Many girls have to apply thick mascara or stick false eyelashes for longer eyelashes, do you have the same trouble as them?<br>-False eyelashes: glues are harmful to the eyelids and may cause pore necrosis.<br>-Mascara: remover is difficult and may make eyelashes / eyebrows fragile and easier to break.<br>-Eyelashes extension / tattoo eyebrows: high cost and may do harm to the original eyelashes / eyebrows.<br><br>Now, stop hurting your eyelashes / eyebrows. Let the Fiery Youth eyelash growth serum give you 100% REAL and HEALTHY eyelashes.<br><br>FUNCTIONS<br>-Protect eyelashes: Prevent damage caused by the external environment, strong eyelashes / eyebrow roots to prevent shedding.<br>-Deeply energize hair follicles: Repair hair follicles caused by sticky false eyelashes, grafted eyelashes and tattoos.<br>-Consolidate the skin base: Soften and purify the base skin around the eyelashes/eyebrows and improve the eyelash base environment.<br>-Nourishing and moisturizing:Provide sufficient nourishment for eyelashes/eyebrows to accelerate the growth of eyelashes/eyebrows.<br>-Gentle and non-irritating: Contain a variety of natural plant extracts, mild, safe, non- irritating.<br><br>INSTRUCTIONS<br>Apply it 1-2 times a day. After cleansing your face, apply the eyelash growth liquid evenly to the base of upper and lower eyelashes, or the eyebrows.<br><br>GREAT RESULTS <br>After using it regularly, users will notice a 20% increase in the thickness and length of eyelashes after 4-6 weeks, and a 50% increase after 60 days.<br><br>GUARANTEE<br>A small portion of users may not respond to the formula. If you are not satisfied after using this product uninterruptedly for 60 days as recommended, feel free to contact us for 100% REFUND. There is literally no risk for you, so don't hesitate to try our eyelash serum.""]"
28588	what brushes are there in this kit?	One Blush/Bronzer Brush, One Eyelash/Brow comb, Two Different Sized Eye shadow Brushes ,Two Different Sized Eyeliner Brushes, One That Fits Inside A Mascara, (TIP- Ran Out Of Liquid Liner? Just Take The Smaller Brush, Dip It In VOILA!!) And One Blending Brush For Waterline Or shadow, They Are Travel Size-Medium So They Are Kinda Small But They Also Are A little Cheap..... One Of The Brushes Broke The first time i used it and they smell funky also they came like 2 months after i ordered it.... If You want good brushes for a good price than I would Go to a Burlington, Tj Maxx, Marshels, Ross ECT. Some type of those stores. If you have any more questions feel free to ask on my buisness email- Skillsducttape@gmail.com Thank You!! Overall 8/10	"[""Color:Gold<br>Big eyes and long eyelashes are important parts in a beautiful look. Many girls have to apply thick mascara or stick false eyelashes for longer eyelashes, do you have the same trouble as them?<br>-False eyelashes: glues are harmful to the eyelids and may cause pore necrosis.<br>-Mascara: remover is difficult and may make eyelashes / eyebrows fragile and easier to break.<br>-Eyelashes extension / tattoo eyebrows: high cost and may do harm to the original eyelashes / eyebrows.<br><br>Now, stop hurting your eyelashes / eyebrows. Let the Fiery Youth eyelash growth serum give you 100% REAL and HEALTHY eyelashes.<br><br>FUNCTIONS<br>-Protect eyelashes: Prevent damage caused by the external environment, strong eyelashes / eyebrow roots to prevent shedding.<br>-Deeply energize hair follicles: Repair hair follicles caused by sticky false eyelashes, grafted eyelashes and tattoos.<br>-Consolidate the skin base: Soften and purify the base skin around the eyelashes/eyebrows and improve the eyelash base environment.<br>-Nourishing and moisturizing:Provide sufficient nourishment for eyelashes/eyebrows to accelerate the growth of eyelashes/eyebrows.<br>-Gentle and non-irritating: Contain a variety of natural plant extracts, mild, safe, non- irritating.<br><br>INSTRUCTIONS<br>Apply it 1-2 times a day. After cleansing your face, apply the eyelash growth liquid evenly to the base of upper and lower eyelashes, or the eyebrows.<br><br>GREAT RESULTS <br>After using it regularly, users will notice a 20% increase in the thickness and length of eyelashes after 4-6 weeks, and a 50% increase after 60 days.<br><br>GUARANTEE<br>A small portion of users may not respond to the formula. If you are not satisfied after using this product uninterruptedly for 60 days as recommended, feel free to contact us for 100% REFUND. There is literally no risk for you, so don't hesitate to try our eyelash serum.""]"
28589	How long are the handles?	They are about the length of your hand to finger tip. I would say an average length	"[""Color:Gold<br>Big eyes and long eyelashes are important parts in a beautiful look. Many girls have to apply thick mascara or stick false eyelashes for longer eyelashes, do you have the same trouble as them?<br>-False eyelashes: glues are harmful to the eyelids and may cause pore necrosis.<br>-Mascara: remover is difficult and may make eyelashes / eyebrows fragile and easier to break.<br>-Eyelashes extension / tattoo eyebrows: high cost and may do harm to the original eyelashes / eyebrows.<br><br>Now, stop hurting your eyelashes / eyebrows. Let the Fiery Youth eyelash growth serum give you 100% REAL and HEALTHY eyelashes.<br><br>FUNCTIONS<br>-Protect eyelashes: Prevent damage caused by the external environment, strong eyelashes / eyebrow roots to prevent shedding.<br>-Deeply energize hair follicles: Repair hair follicles caused by sticky false eyelashes, grafted eyelashes and tattoos.<br>-Consolidate the skin base: Soften and purify the base skin around the eyelashes/eyebrows and improve the eyelash base environment.<br>-Nourishing and moisturizing:Provide sufficient nourishment for eyelashes/eyebrows to accelerate the growth of eyelashes/eyebrows.<br>-Gentle and non-irritating: Contain a variety of natural plant extracts, mild, safe, non- irritating.<br><br>INSTRUCTIONS<br>Apply it 1-2 times a day. After cleansing your face, apply the eyelash growth liquid evenly to the base of upper and lower eyelashes, or the eyebrows.<br><br>GREAT RESULTS <br>After using it regularly, users will notice a 20% increase in the thickness and length of eyelashes after 4-6 weeks, and a 50% increase after 60 days.<br><br>GUARANTEE<br>A small portion of users may not respond to the formula. If you are not satisfied after using this product uninterruptedly for 60 days as recommended, feel free to contact us for 100% REFUND. There is literally no risk for you, so don't hesitate to try our eyelash serum.""]"
